{
  "schema": "sbf.protocol-target-scope/1",
  "target": {
    "id": "PROTO-asyncapi-01",
    "family": "asyncapi",
    "title": "AsyncAPI 2.x and 3.x document importer"
  },
  "plan_write_scope": {
    "declared": "adapters/protocol/asyncapi/**",
    "actual": [
      "adapters/protocol-next/targets/asyncapi/**",
      "adapters/protocol-next/schemas/protocol-target-scope.schema.json",
      "test/protocol-next/**"
    ],
    "reason": "The directory adapters/protocol/ does not exist; the T18 protocol suite owns adapters/protocol-next/** (implementation, records) and test/protocol-next/** (tests, fixtures)."
  },
  "status": "scope-recorded",
  "verified_on": "2026-10-08",
  "adapter": {
    "entry": "adapters/protocol-next/scanners/protocol-loaders.mjs#loadProtocolArtifact",
    "dependencies": [
      "yaml"
    ]
  },
  "profile": {
    "inputs": [
      "AsyncAPI documents in YAML or JSON (asyncapi.yaml, asyncapi.json)"
    ],
    "dialects": [
      "asyncapi-1.2.0",
      "asyncapi-2.0.0",
      "asyncapi-2.1.0",
      "asyncapi-2.2.0",
      "asyncapi-2.3.0",
      "asyncapi-2.4.0",
      "asyncapi-2.5.0",
      "asyncapi-2.6.0",
      "asyncapi-2.6.1",
      "asyncapi-3.0",
      "asyncapi-3.0.0",
      "asyncapi-3.0.0-rc1",
      "asyncapi-3.0.1",
      "asyncapi-3.1.0",
      "asyncapi-3.9.9",
      "asyncapi-4.0.0",
      "asyncapi-unknown",
      "asyncapi-v3.0.0"
    ],
    "scan_status": "partial",
    "versions": {
      "version_pattern": "^(?:2|3)\\.\\d+\\.\\d+$",
      "untested_warning": "ASYNCAPI_VERSION_UNTESTED",
      "missing_warning": "ASYNCAPI_VERSION_MISSING",
      "reference_parser_supported_versions": [
        "2.0.0",
        "2.1.0",
        "2.2.0",
        "2.3.0",
        "2.4.0",
        "2.5.0",
        "2.6.0",
        "3.0.0",
        "3.1.0"
      ],
      "reference_spec_tags": [
        "v2.6.0",
        "v3.0.0",
        "v3.1.0"
      ],
      "broker_and_client_libraries": "UNKNOWN: the importer reads no servers, bindings or client library, so no broker product, broker version or client library version is recorded, exercised or pinned; host, protocol and protocolVersion under servers are dropped"
    }
  },
  "pins": {
    "libraries": [
      {
        "id": "lib-asyncapi-parser-3.6.3",
        "name": "@asyncapi/parser",
        "version": "3.6.3",
        "integrity": "sha512-MUC8xIUMcS2qNvqrqyx/ie0txu3d/OdIsrXs7UCzawdyR6P07gh35DpOqPz/z57s1UA3vERVpcheZYl3h8cVtw==",
        "published": "2026-08-08T07:50:40.356Z",
        "role": "reference parser of the static oracle run",
        "selected": true,
        "recomputable_from": "test/protocol-next/fixtures/targets/oracle-locks/aapi.lock.json"
      },
      {
        "id": "lib-asyncapi-specs-6.11.1",
        "name": "@asyncapi/specs",
        "version": "6.11.1",
        "integrity": "sha512-A3WBLqAKGoJ2+6FWFtpjBlCQ1oFCcs4GxF7zsIGvNqp/klGUHjlA3aAcZ9XMMpLGE8zPeYDz2x9FmO6DSuKraQ==",
        "published": "2026-01-30T15:29:14.004Z",
        "role": "JSON schemas used by the reference parser (the latest published release; 6.11.2 is not published)",
        "selected": true,
        "recomputable_from": "test/protocol-next/fixtures/targets/oracle-locks/aapi.lock.json"
      },
      {
        "id": "lib-yaml-2.9.0",
        "name": "yaml",
        "version": "2.9.0",
        "integrity": "sha512-2AvhNX3mb8zd6Zy7INTtSpl1F15HW6Wnqj0srWlkKLcpYl/gMIMJiyuGq2KeI2YFxUPjdlB+3Lc10seMLtL4cA==",
        "published": "2026-05-11T10:16:24.045Z",
        "role": "importer runtime dependency (YAML and JSON document decoding), version from the root lock",
        "selected": true,
        "recomputable_from": "package-lock.json"
      }
    ],
    "documents": [],
    "tags": [
      {
        "id": "tag-asyncapi-spec-v3.1.0",
        "repo": "https://github.com/asyncapi/spec",
        "tag": "v3.1.0",
        "commit": "b3fac5bb522771428ea57b16129b273cd3ea0180",
        "published": "2026-01-31T11:24:10Z",
        "selected": true
      },
      {
        "id": "tag-asyncapi-spec-v3.0.0",
        "repo": "https://github.com/asyncapi/spec",
        "tag": "v3.0.0",
        "commit": "d78dcea70c9b094a3df72f9a4e811828cec778cc",
        "published": "2023-12-05T09:29:26Z",
        "selected": true
      },
      {
        "id": "tag-asyncapi-spec-v2.6.0",
        "repo": "https://github.com/asyncapi/spec",
        "tag": "v2.6.0",
        "commit": "1824379ba6252bfb52550337a86ca9b10a33b3aa",
        "published": "2023-02-01T16:01:35Z",
        "selected": true
      },
      {
        "id": "tag-asyncapi-spec-v3.0.1",
        "repo": "https://github.com/asyncapi/spec",
        "tag": "v3.0.1",
        "commit": "4ae48a3664c7bb9973c8ce4c391dc590a29cc5f6",
        "published": "2023-12-13T11:45:09Z",
        "selected": false,
        "release_name": "v3.0.1 - INVALID",
        "why_not": "the release is titled \"v3.0.1 - INVALID\" and the official parser 3.6.3 rejects version 3.0.1"
      }
    ],
    "absent_tags": [
      {
        "id": "absent-asyncapi-spec-tags",
        "repo": "https://github.com/asyncapi/spec",
        "tags": [
          "v2.6.1",
          "2.6.1",
          "v3.9.9",
          "3.9.9"
        ]
      }
    ]
  },
  "supported": [
    {
      "id": "S-AAPI-VERSION-PATTERN",
      "statement": "An asyncapi value that is a string matching ^(?:2|3)\\.\\d+\\.\\d+$ selects the dialect asyncapi-<value> without a warning. Every version the official parser 3.6.3 accepts (2.0.0 to 2.6.0, 3.0.0, 3.1.0) is covered; the pattern also admits versions the parser rejects.",
      "fixtures": [
        "aapi-v-supported-2.0.0",
        "aapi-v-supported-2.1.0",
        "aapi-v-supported-2.2.0",
        "aapi-v-supported-2.3.0",
        "aapi-v-supported-2.4.0",
        "aapi-v-supported-2.5.0",
        "aapi-v-supported-2.6.0",
        "aapi-v-supported-3.0.0",
        "aapi-v-supported-3.1.0",
        "aapi-v-silent-2.6.1",
        "aapi-v-silent-3.0.1",
        "aapi-v-silent-3.9.9"
      ]
    },
    {
      "id": "S-AAPI-VERSION-WARNINGS",
      "statement": "A string that does not match the pattern yields ASYNCAPI_VERSION_UNTESTED (dialect asyncapi-<value>); an absent, empty or non-string value yields ASYNCAPI_VERSION_MISSING (dialect asyncapi-unknown). Neither warning blocks the scan.",
      "fixtures": [
        "aapi-v-untested-4.0.0",
        "aapi-v-untested-1.2.0",
        "aapi-v-untested-3.0.0-rc1",
        "aapi-v-untested-v3.0.0",
        "aapi-v-untested-quoted-3.0",
        "aapi-v-missing-key",
        "aapi-v-missing-numeric-3",
        "aapi-v-missing-empty-string",
        "aapi-v-missing-unquoted-3.0"
      ]
    },
    {
      "id": "S-AAPI-V2-CHANNELS",
      "statement": "AsyncAPI 2.x channels with publish and subscribe operations (operationId, message references) and components.messages are recorded as channel, operation and message records.",
      "fixtures": [
        "aapi-n01-v2.6.0-publish-subscribe"
      ]
    },
    {
      "id": "S-AAPI-V3-OPERATIONS",
      "statement": "AsyncAPI 3.x channels (address), operations (action send or receive, channel reference, message references) and components.messages are recorded as channel, operation and message records.",
      "fixtures": [
        "aapi-n02-v3.0.0-operations",
        "aapi-n03-v3.1.0-operations"
      ]
    },
    {
      "id": "S-AAPI-SERIALIZATION-INDEPENDENT",
      "statement": "YAML and JSON spellings of the same document produce the same contract planes.",
      "fixtures": [
        "aapi-n02-v3.0.0-operations",
        "aapi-n04-v3.0.0-json-serialization"
      ]
    },
    {
      "id": "S-AAPI-BLOCKED-AND-ERRORS",
      "statement": "A document with neither version nor channels, or with a version but no channels, is blocked and cannot produce a protocol contract; a remote $ref, a non-object document and undecodable YAML raise errors.",
      "fixtures": [
        "aapi-x01-empty-object",
        "aapi-x02-version-only",
        "aapi-x03-remote-ref-denied",
        "aapi-x04-top-level-array",
        "aapi-x05-invalid-yaml",
        "aapi-x06-scalar-document"
      ]
    }
  ],
  "unsupported": [
    {
      "id": "U-AAPI-BINDINGS",
      "behavior": "dropped",
      "statement": "Server, channel, operation and message bindings (mqtt qos and retain, kafka topic, partitions, group and key, amqp ack and deliveryMode, bindingVersion) are not recorded: documents that differ only in bindings produce identical contract planes.",
      "fixtures": [
        "aapi-c00-control-minimal-send",
        "aapi-c01-mqtt-qos-2",
        "aapi-c01b-mqtt-qos-0",
        "aapi-c02-kafka-amqp-bindings"
      ]
    },
    {
      "id": "U-AAPI-SERVERS",
      "behavior": "dropped",
      "statement": "servers (host, protocol, protocolVersion) are not recorded, so broker identity and broker version are unknown for every scanned document.",
      "fixtures": [
        "aapi-c00-control-minimal-send",
        "aapi-c04-servers-broker-identity"
      ]
    },
    {
      "id": "U-AAPI-REPLY-CORRELATION",
      "behavior": "dropped",
      "statement": "Operation reply (request-reply) and message correlationId are not recorded.",
      "fixtures": [
        "aapi-c00-control-minimal-send",
        "aapi-c03-reply-and-correlation-id"
      ]
    },
    {
      "id": "U-AAPI-RETRY-IDEMPOTENCY-DELIVERY",
      "behavior": "dropped",
      "statement": "No retry, idempotency or delivery-guarantee semantics. AsyncAPI documents carry them only in bindings, extensions and message headers (x-retry, x-idempotency-key, x-delivery, an idempotency header); none is recorded. At the flow layer retry, idempotency and timeout are caller declarations that nothing ties to the document, and delivery, qos, ack and redelivery step fields are silently dropped.",
      "fixtures": [
        "aapi-c10-retry-idempotency-delivery-declared",
        "aapi-c00-control-minimal-send",
        "aapi-c01-mqtt-qos-2",
        "aapi-f01-retry-idempotency-timeout-declared",